{
  "$schema": "https://json-schema.org/draft/2020-12/schema",
  "$id": "https://osyka-yuri.github.io/renderpilot-libraries/schemas/library_vendor_source.schema.json",
  "title": "RenderPilot curated library vendor source",
  "type": "object",
  "required": [
    "schema_version",
    "vendor",
    "generated_at",
    "legal_documents",
    "artifacts",
    "packages"
  ],
  "additionalProperties": false,
  "properties": {
    "schema_version": { "const": 1 },
    "vendor": { "$ref": "#/$defs/vendor" },
    "generated_at": { "type": "string", "format": "date-time" },
    "legal_documents": {
      "type": "array",
      "items": { "$ref": "#/$defs/legalDocument" }
    },
    "artifacts": {
      "type": "array",
      "items": { "$ref": "#/$defs/artifact" }
    },
    "packages": {
      "type": "array",
      "items": { "$ref": "#/$defs/package" }
    }
  },
  "$defs": {
    "vendor": {
      "type": "object",
      "required": ["id", "display_name"],
      "additionalProperties": false,
      "properties": {
        "id": { "$ref": "#/$defs/id" },
        "display_name": { "type": "string", "minLength": 1 }
      }
    },
    "artifact": {
      "type": "object",
      "required": [
        "artifact_key",
        "library_id",
        "file_name",
        "file_version",
        "architecture",
        "dll",
        "transport",
        "signature"
      ],
      "additionalProperties": false,
      "properties": {
        "artifact_key": { "$ref": "#/$defs/id" },
        "library_id": { "$ref": "#/$defs/id" },
        "file_name": { "$ref": "#/$defs/dllName" },
        "file_version": {
          "anyOf": [{ "$ref": "#/$defs/version" }, { "type": "null" }]
        },
        "architecture": { "$ref": "#/$defs/architecture" },
        "pe_named_exports": { "$ref": "#/$defs/peNamedExports" },
        "dll": { "$ref": "#/$defs/content" },
        "transport": { "$ref": "#/$defs/sourceTransport" },
        "signature": { "$ref": "#/$defs/signature" },
        "extensions": { "$ref": "#/$defs/extensions" }
      }
    },
    "package": {
      "type": "object",
      "required": [
        "package_id",
        "technology",
        "variant",
        "display_name",
        "release",
        "target",
        "members"
      ],
      "additionalProperties": false,
      "properties": {
        "package_id": { "$ref": "#/$defs/id" },
        "technology": { "$ref": "#/$defs/id" },
        "variant": { "$ref": "#/$defs/id" },
        "display_name": {
          "description": "User-facing package name. Presentation-only metadata excluded from package revision identity.",
          "type": "string",
          "minLength": 1
        },
        "release": { "$ref": "#/$defs/release" },
        "target": { "$ref": "#/$defs/target" },
        "provenance": { "$ref": "#/$defs/provenance" },
        "legal_document_ids": {
          "type": "array",
          "minItems": 1,
          "uniqueItems": true,
          "items": { "$ref": "#/$defs/legalDocumentId" }
        },
        "members": {
          "type": "array",
          "minItems": 1,
          "items": { "$ref": "#/$defs/sourceMember" }
        },
        "extensions": { "$ref": "#/$defs/extensions" }
      }
    },
    "sourceMember": {
      "type": "object",
      "required": ["artifact_key", "role", "install_as"],
      "additionalProperties": false,
      "properties": {
        "artifact_key": { "$ref": "#/$defs/id" },
        "role": { "$ref": "#/$defs/id" },
        "install_as": { "$ref": "#/$defs/dllName" }
      }
    },
    "content": {
      "type": "object",
      "required": ["sha256", "size_bytes"],
      "additionalProperties": false,
      "properties": {
        "sha256": { "$ref": "#/$defs/sha256" },
        "size_bytes": { "type": "integer", "minimum": 1 }
      }
    },
    "legalDocument": {
      "type": "object",
      "required": ["legal_document_id", "kind", "title", "format", "file_name", "content"],
      "additionalProperties": false,
      "properties": {
        "legal_document_id": { "$ref": "#/$defs/legalDocumentId" },
        "kind": { "enum": ["license", "notice"] },
        "title": { "type": "string", "minLength": 1, "maxLength": 256 },
        "format": { "enum": ["text", "pdf"] },
        "file_name": {
          "type": "string",
          "maxLength": 128,
          "pattern": "^[A-Za-z0-9._-]+\\.(?:md|pdf|txt)$"
        },
        "content": { "$ref": "#/$defs/legalContent" }
      }
    },
    "legalContent": {
      "type": "object",
      "required": ["sha256", "size_bytes"],
      "additionalProperties": false,
      "properties": {
        "sha256": { "$ref": "#/$defs/sha256" },
        "size_bytes": { "type": "integer", "minimum": 1, "maximum": 16777216 }
      }
    },
    "sourceTransport": {
      "description": "Provider-neutral compressed-payload identity projected into the public transport contract.",
      "type": "object",
      "required": ["sha256", "size_bytes"],
      "additionalProperties": false,
      "properties": {
        "sha256": { "$ref": "#/$defs/sha256" },
        "size_bytes": { "type": "integer", "minimum": 1 }
      }
    },
    "release": {
      "type": "object",
      "required": ["version", "channel", "label"],
      "additionalProperties": false,
      "properties": {
        "version": {
          "description": "Canonical package version used for presentation, ordering, and candidate selection.",
          "$ref": "#/$defs/packageVersion"
        },
        "channel": {
          "description": "Behaviorally significant release stability channel.",
          "enum": ["stable", "beta", "preview", "debug"]
        },
        "label": {
          "description": "Optional concise annotation appended verbatim to the package version. It must contain only supplemental information and must not repeat the package version or display name.",
          "type": ["string", "null"],
          "minLength": 1
        }
      }
    },
    "target": {
      "type": "object",
      "required": ["os", "architecture"],
      "additionalProperties": false,
      "properties": {
        "os": { "const": "windows" },
        "architecture": { "$ref": "#/$defs/architecture" },
        "compatibility": { "$ref": "#/$defs/compatibility" }
      }
    },
    "compatibility": {
      "type": "object",
      "required": ["kind", "version"],
      "additionalProperties": false,
      "properties": {
        "kind": { "const": "d3d12_sdk" },
        "version": { "type": "integer", "minimum": 1 }
      }
    },
    "provenance": {
      "oneOf": [
        {
          "type": "object",
          "required": ["kind", "package_id", "version", "package_sha512"],
          "additionalProperties": false,
          "properties": {
            "kind": { "const": "nuget" },
            "package_id": { "type": "string", "minLength": 1 },
            "version": { "$ref": "#/$defs/packageVersion" },
            "package_sha512": {
              "type": "string",
              "pattern": "^[A-Za-z0-9+/]{86}==$"
            }
          }
        },
        {
          "type": "object",
          "required": ["kind", "repository", "tag", "commit_sha"],
          "additionalProperties": false,
          "properties": {
            "kind": { "const": "github_release" },
            "repository": {
              "type": "string",
              "pattern": "^[A-Za-z0-9_.-]+/[A-Za-z0-9_.-]+$"
            },
            "tag": { "type": "string", "minLength": 1 },
            "commit_sha": { "type": "string", "pattern": "^[0-9a-f]{40}$" }
          }
        }
      ]
    },
    "peNamedExports": {
      "type": "array",
      "minItems": 1,
      "maxItems": 16384,
      "uniqueItems": true,
      "items": {
        "type": "string",
        "minLength": 1,
        "maxLength": 256,
        "pattern": "^[ -~]+$"
      }
    },
    "signature": {
      "oneOf": [
        {
          "type": "object",
          "required": ["status"],
          "additionalProperties": false,
          "properties": { "status": { "const": "unsigned" } }
        },
        {
          "type": "object",
          "required": ["status", "signed_at"],
          "additionalProperties": false,
          "properties": {
            "status": { "const": "signed" },
            "subject": {
              "description": "Signer subject when certificate metadata was captured; older curated records may omit it.",
              "type": "string",
              "minLength": 1
            },
            "thumbprint": {
              "description": "Signer certificate thumbprint when captured; older curated records may omit it.",
              "type": "string",
              "pattern": "^[A-F0-9]{40,64}$"
            },
            "signed_at": {
              "description": "Verified or historically recorded signing time. Generated providers use null only when no timestamp attribute exists; older curated records can be incomplete.",
              "type": ["string", "null"],
              "format": "date-time"
            }
          }
        }
      ]
    },
    "extensions": { "type": "object", "additionalProperties": true },
    "id": { "type": "string", "pattern": "^[a-z][a-z0-9._-]*$" },
    "legalDocumentId": {
      "type": "string",
      "pattern": "^(?:license|notice)\\.[0-9a-f]{64}$"
    },
    "sha256": { "type": "string", "pattern": "^[0-9a-f]{64}$" },
    "dllName": { "type": "string", "pattern": "^[A-Za-z0-9._-]+\\.dll$" },
    "architecture": { "enum": ["X64", "X86"] },
    "version": {
      "type": "string",
      "pattern": "^(?:0|[1-9]\\d*)(?:\\.(?:0|[1-9]\\d*))*$"
    },
    "packageVersion": {
      "type": "string",
      "description": "Canonical NuGet/SemVer2 identity with build metadata removed.",
      "pattern": "^(?:0|[1-9]\\d*)(?:\\.(?:0|[1-9]\\d*)){0,3}(?:-[0-9a-z-]+(?:\\.[0-9a-z-]+)*)?$"
    }
  }
}
